{
  "format_version": 1,
  "application_version": "0.88.0",
  "database_version": 40,
  "rows_per_chunk": 1000,
  "max_files": 100000,
  "max_file_bytes": 1073741824,
  "max_total_bytes": 107374182400,
  "tables": {
    "generation_base_models": [
      "id",
      "name",
      "created_at",
      "updated_at"
    ],
    "works": [
      "id",
      "source_id",
      "source_url",
      "source_version",
      "source_updated_at",
      "name",
      "name_normalized",
      "aliases_json",
      "category_name",
      "is_available",
      "created_at",
      "updated_at",
      "cover_media_path"
    ],
    "characters": [
      "id",
      "work_id",
      "source_id",
      "source_url",
      "source_version",
      "source_updated_at",
      "name",
      "name_normalized",
      "aliases_json",
      "prompt_text",
      "is_available",
      "created_at",
      "updated_at",
      "cover_media_path"
    ],
    "styles": [
      "id",
      "base_model_id",
      "name",
      "aliases_json",
      "prompt_text",
      "style_description",
      "cover_media_path"
    ],
    "prompt_terms": [
      "id",
      "canonical_tag",
      "category",
      "post_count",
      "aliases_json",
      "created_at",
      "updated_at"
    ],
    "generation_models": [
      "id",
      "base_model_id",
      "file_name",
      "file_format",
      "precision_or_quantization",
      "author",
      "version",
      "release_url",
      "published_at",
      "description",
      "usage",
      "skill_name",
      "cover_media_path",
      "created_at",
      "updated_at"
    ],
    "generation_loras": [
      "id",
      "base_model_id",
      "model_id",
      "file_name",
      "file_format",
      "precision_or_quantization",
      "author",
      "version",
      "release_url",
      "description",
      "usage",
      "cover_media_path",
      "created_at",
      "updated_at",
      "trigger_words_json",
      "weight"
    ],
    "artist_prompt_strings": [
      "id",
      "title",
      "description",
      "artist_string",
      "base_model_id",
      "cover_media_path",
      "created_at",
      "updated_at"
    ],
    "artist_prompt_string_styles": [
      "artist_prompt_string_id",
      "style_id"
    ],
    "comfyui_instances": [
      "id",
      "title",
      "url",
      "credential_type",
      "credential_ciphertext",
      "is_enabled",
      "is_valid",
      "created_at",
      "updated_at"
    ],
    "comfyui_templates": [
      "id",
      "base_model_id",
      "model_id",
      "lora_id",
      "template_type",
      "title",
      "template_json",
      "cover_media_path",
      "created_at",
      "updated_at"
    ],
    "item_images": [
      "id",
      "owner_kind",
      "owner_id",
      "source_id",
      "source_url",
      "content_hash",
      "media_path",
      "sort_order",
      "created_at",
      "updated_at"
    ]
  },
  "empty_tables": [
    "artist_prompt_string_styles",
    "artist_prompt_strings",
    "audit_events",
    "characters",
    "comfyui_instances",
    "comfyui_templates",
    "data_import_batches",
    "generation_base_models",
    "generation_loras",
    "generation_models",
    "item_images",
    "iterative_image_task_loras",
    "iterative_image_task_rounds",
    "iterative_image_task_skills",
    "iterative_image_task_write_requests",
    "iterative_image_tasks",
    "management_skill_sessions",
    "pi_session_orphans",
    "prompt_terms",
    "session_turn_skills",
    "sessions",
    "styles",
    "vector_entries",
    "vector_knn_index",
    "vector_knn_index_vector_chunks00",
    "works"
  ],
  "initialization_tables": [
    "schema_migrations",
    "vector_spaces"
  ],
  "image_owners": {
    "work": "works",
    "character": "characters",
    "style": "styles",
    "model": "generation_models",
    "lora": "generation_loras",
    "artist_prompt_string": "artist_prompt_strings",
    "template": "comfyui_templates"
  }
}
